{
  "event_id": "evt_01j6zq9a1b2c3d4e5f6g7h8i9j",
  "event_type": "message.queued.v1",
  "occurred_at": "2026-07-20T12:00:00.120Z",
  "tenant_id": "ten_01j6zp0a1b2c3d4e5f6g7h8i9j",
  "correlation_id": "req_01j6zq8k2n3p4r5s6t7u8v9w0y",
  "data": {
    "message_id": "msg_01j6zq8k2n3p4r5s6t7u8v9w0x",
    "channel": "whatsapp",
    "to": "+385911234567",
    "queued_at": "2026-07-20T12:00:00.100Z",
    "metadata": {
      "campaign": "welcome"
    }
  }
}
